Organización/Departamento,Descripción del involucramiento deseado,Nombre / Rol de Contraparte
Departamento de salud pública de Chicago,En todos los pasos del proyecto,Tomadores de decisiones
Gobierno de Illinois,Conocer los objetivos del proyecto,Facilitador de información
Departamento de finanzas,Emisión de facturas,Proveedor de los recursos económicos
"Proveedor de infraestructura, servicios tecnológicos y almacenamiento de datos",Implementación de las herramientas requeridas,Proveedor de servicios e infraestructura
Secretaría de Educación,Autorización y comunicación de inspecciones,Encargado de informar y autorizar ingreso de inspectores a planteles educativos
